{
  "$schema": "https://json-schema.org/draft/2020-12/schema",
  "$id": "https://puretokensx.com/schemas/model-index.schema.json",
  "title": "Pure Tokens installed media model index",
  "type": "object",
  "required": ["schemaVersion", "capability", "catalogUpdatedAt", "catalogCapturedAt", "defaultModel", "models"],
  "properties": {
    "$schema": { "const": "https://puretokensx.com/schemas/model-index.schema.json" },
    "schemaVersion": { "const": 1 },
    "capability": { "enum": ["image", "video"] },
    "catalogUpdatedAt": { "type": "string", "minLength": 1 },
    "catalogCapturedAt": { "type": "string", "format": "date-time" },
    "defaultModel": { "type": "string", "maxLength": 160, "pattern": "^(?!\\.{1,2}$)[A-Za-z0-9_.-]+(\\([A-Za-z0-9_.-]+\\))?$(?![\\s\\S])" },
    "models": {
      "type": "array",
      "minItems": 1,
      "items": {
        "type": "object",
        "required": ["id", "aliases", "profile"],
        "properties": {
          "id": { "type": "string", "maxLength": 160, "pattern": "^(?!\\.{1,2}$)[A-Za-z0-9_.-]+(\\([A-Za-z0-9_.-]+\\))?$(?![\\s\\S])" },
          "aliases": {
            "type": "array",
            "uniqueItems": true,
            "items": { "type": "string", "minLength": 1, "maxLength": 160 }
          },
          "profile": { "type": "string", "maxLength": 174, "pattern": "^profiles/(?!\\.{1,2}\\.json$)[A-Za-z0-9_.-]+(\\([A-Za-z0-9_.-]+\\))?\\.json$(?![\\s\\S])" }
        },
        "additionalProperties": false
      }
    }
  },
  "additionalProperties": false
}
