{
  "$schema": "https://puretokensx.com/schemas/model-index.schema.json",
  "schemaVersion": 1,
  "capability": "video",
  "catalogUpdatedAt": "2026-10-04",
  "catalogCapturedAt": "2026-10-04T06:19:22.134Z",
  "defaultModel": "minimax_h3",
  "models": [
    {
      "id": "grok-imagine-video",
      "aliases": [
        "grok video"
      ],
      "profile": "profiles/grok-imagine-video.json"
    },
    {
      "id": "grok-imagine-video-1.5",
      "aliases": [],
      "profile": "profiles/grok-imagine-video-1.5.json"
    },
    {
      "id": "minimax_h3",
      "aliases": [],
      "profile": "profiles/minimax_h3.json"
    },
    {
      "id": "omni",
      "aliases": [],
      "profile": "profiles/omni.json"
    },
    {
      "id": "seedance-2.0",
      "aliases": [],
      "profile": "profiles/seedance-2.0.json"
    },
    {
      "id": "seedance-2.0-fast",
      "aliases": [],
      "profile": "profiles/seedance-2.0-fast.json"
    },
    {
      "id": "seedance-2.0-mini",
      "aliases": [],
      "profile": "profiles/seedance-2.0-mini.json"
    },
    {
      "id": "seedance-2.5",
      "aliases": [],
      "profile": "profiles/seedance-2.5.json"
    },
    {
      "id": "seedance2.0",
      "aliases": [],
      "profile": "profiles/seedance2.0.json"
    },
    {
      "id": "veo_fast",
      "aliases": [],
      "profile": "profiles/veo_fast.json"
    },
    {
      "id": "veo_lite",
      "aliases": [],
      "profile": "profiles/veo_lite.json"
    },
    {
      "id": "veo_quan",
      "aliases": [],
      "profile": "profiles/veo_quan.json"
    },
    {
      "id": "wan3.0-video",
      "aliases": [
        "wan3 video",
        "wan 3 video"
      ],
      "profile": "profiles/wan3.0-video.json"
    },
    {
      "id": "wan3.0-video-prime",
      "aliases": [
        "wan3 video prime",
        "wan 3 video prime"
      ],
      "profile": "profiles/wan3.0-video-prime.json"
    }
  ]
}
